{
  "event_type": "deploy_event",
  "source": "github_actions",
  "repo": "my-infra",
  "status": "success",
  "deployed_services": {
    "pi": ["web-app", "dns"],
    "vps": ["automation"]
  },
  "failed_services": {
    "pi": [],
    "vps": []
  },
  "run_url": "https://github.com/example/my-infra/actions/runs/12345",
  "commit_sha": "abc123def456"
}
